{
  "corpus_ids": [
    "pc-internet-01a",
    "pc-owner-01a",
    "pc-owner-01b"
  ],
  "data_tables": [
    {
      "local_transformations": "None recorded.",
      "path": "src/kadishutu/data/tables/README.md",
      "platform_build": null,
      "sha256": "923cf776e5981e8af14ab2ee7e79bdf5b45052bd59f5056afb1e4f193df29279",
      "upstream": "GameBanana post 11793083 and linked Skill/Demon spreadsheets; local README is the provenance record."
    },
    {
      "local_transformations": "None recorded.",
      "path": "src/kadishutu/data/tables/SMT5V NKM Base Table_Navi Devil Data - Item Names.csv",
      "platform_build": null,
      "sha256": "b8a2f24ad31bf542bf15a7adcbb8aad58fb05bf3aa0324303765ecb139db7374",
      "upstream": "GameBanana post 11793083 and linked Skill/Demon spreadsheets; local README is the provenance record."
    },
    {
      "local_transformations": "Added Pot prefixes to potential columns.",
      "path": "src/kadishutu/data/tables/SMT5V NKM Base Table_Navi Devil Data - Players.csv",
      "platform_build": null,
      "sha256": "a9a9806f65751c92415b3195c5d28209d0e460622eeb271b65628cb0bc960317",
      "upstream": "GameBanana post 11793083 and linked Skill/Demon spreadsheets; local README is the provenance record."
    },
    {
      "local_transformations": "Replaced the infinity symbol with inf.",
      "path": "src/kadishutu/data/tables/SMT5V Skill Data Tables - ActionSkills.csv",
      "platform_build": null,
      "sha256": "f1829ed362429f7c448cffb642a8f21672d8196838d18c26716d7972e20f56b7",
      "upstream": "GameBanana post 11793083 and linked Skill/Demon spreadsheets; local README is the provenance record."
    },
    {
      "local_transformations": "None recorded.",
      "path": "src/kadishutu/data/tables/SMT5V Skill Data Tables - AutoSkills.csv",
      "platform_build": null,
      "sha256": "93de80b87d6c209a71a297e6e96a10dd4fd14e738e61d3dd8970104d1098ad42",
      "upstream": "GameBanana post 11793083 and linked Skill/Demon spreadsheets; local README is the provenance record."
    },
    {
      "local_transformations": "None recorded.",
      "path": "src/kadishutu/data/tables/alignment_data.json",
      "platform_build": null,
      "sha256": "787a7d0e6a5ea9d71eadaef18210045a752e199e206a233bbac0ecc0aedd61d1",
      "upstream": "GameBanana post 11793083 and linked Skill/Demon spreadsheets; local README is the provenance record."
    },
    {
      "local_transformations": "None recorded.",
      "path": "src/kadishutu/data/tables/item_extra_data.json",
      "platform_build": null,
      "sha256": "c2c189ac96bb01a45fe1faef22c9d26931f7c3b847e7d2f9be2deb93610b313a",
      "upstream": "GameBanana post 11793083 and linked Skill/Demon spreadsheets; local README is the provenance record."
    },
    {
      "local_transformations": "None recorded.",
      "path": "src/kadishutu/data/tables/laylines.json",
      "platform_build": null,
      "sha256": "126a8315effac5239636b2e39e2bb1f6405d3ca8190e89fc936a1de2dc0a871d",
      "upstream": "GameBanana post 11793083 and linked Skill/Demon spreadsheets; local README is the provenance record."
    },
    {
      "local_transformations": "None recorded.",
      "path": "src/kadishutu/data/tables/miracle_unlocks.json",
      "platform_build": null,
      "sha256": "d2b22a2d0b74e3ef85462a0989f700361828f109f810402667d79ab2ed3eea31",
      "upstream": "GameBanana post 11793083 and linked Skill/Demon spreadsheets; local README is the provenance record."
    },
    {
      "local_transformations": "None recorded.",
      "path": "src/kadishutu/data/tables/miracles.json",
      "platform_build": null,
      "sha256": "8e396ba4d8456c2641651fa2b79c5b504e9bf38f54359e080ad18030055c5031",
      "upstream": "GameBanana post 11793083 and linked Skill/Demon spreadsheets; local README is the provenance record."
    },
    {
      "local_transformations": "None recorded.",
      "path": "src/kadishutu/data/tables/save_locs.json",
      "platform_build": null,
      "sha256": "a19b3494f9c661f632bc8ddf73a8d750648022a6a29662db4e053c81a7154931",
      "upstream": "GameBanana post 11793083 and linked Skill/Demon spreadsheets; local README is the provenance record."
    }
  ],
  "defects": [
    {
      "description": "Assertions validate user data and optimization can remove them.",
      "id": "python-assertions",
      "path": "src/kadishutu/core/shared/editors.py",
      "stage": "Stage 1 regression",
      "symbol": "EditorGetter"
    },
    {
      "description": "Entries start at the count instead of after it.",
      "id": "python-custom-version-overlap",
      "path": "src/kadishutu/core/shared/unreal_editors.py",
      "stage": "Stage 1 regression",
      "symbol": "CustomVersionsEditor.versions"
    },
    {
      "description": "Capacity claims conflict at 30 and 24.",
      "id": "python-demon-capacity-conflict",
      "path": "src/kadishutu/core/game_save/demons.py",
      "stage": "Blocked mutation test",
      "symbol": "DEMON_TABLE_SIZE and DemonManager.DEMON_STORAGE"
    },
    {
      "description": "Legacy edits overwrite the input without a transaction.",
      "id": "python-direct-overwrite",
      "path": "src/kadishutu/editor_cli.py",
      "stage": "Blocked mutation test",
      "symbol": "cmd_edit"
    },
    {
      "description": "The +0x380 descriptor aliases later item bytes.",
      "id": "python-essence-metadata-alias",
      "path": "src/kadishutu/core/game_save/essences.py",
      "stage": "Blocked mutation test",
      "symbol": "EssenceEditor.metadata"
    },
    {
      "description": "Complete boundary and count are unknown.",
      "id": "python-incomplete-compendium",
      "path": "src/kadishutu/core/game_save/compendium.py",
      "stage": "Blocked read test",
      "symbol": "CompendiumManager"
    },
    {
      "description": "Entry contains unknown bytes and has a provisional boundary.",
      "id": "python-incomplete-quests",
      "path": "src/kadishutu/core/game_save/quests.py",
      "stage": "Blocked read test",
      "symbol": "QuestEditor"
    },
    {
      "description": "The state method is tested without calling it.",
      "id": "python-missing-encrypt-call",
      "path": "src/kadishutu/cli.py",
      "stage": "Stage 1 absent-command regression",
      "symbol": "cmd_encrypt"
    },
    {
      "description": "Inspect traverses arbitrary attributes.",
      "id": "python-reflective-inspect",
      "path": "src/kadishutu/cli.py",
      "stage": "Stage 1 regression",
      "symbol": "cmd_inspect"
    },
    {
      "description": "Command executes arbitrary Python.",
      "id": "python-run-script",
      "path": "src/kadishutu/cli.py",
      "stage": "Stage 1 absent-command regression",
      "symbol": "cmd_run_script"
    },
    {
      "description": "General stat edits omit proven game-side recalculation behavior.",
      "id": "python-stats-recalculation",
      "path": "src/kadishutu/core/game_save/demons.py",
      "stage": "Blocked mutation test",
      "symbol": "DemonManager.new_from_initial"
    }
  ],
  "experiments": [
    {
      "id": "exp-pc-candidate-01",
      "result": "Three private PC cases from two independent source groups have length 449680, identical exact UE headers, valid GVAS markers, and stored SHA-1 values that independently match SHA-1 over 0x40..EOF. Their encrypted members are distinct AES-block sequences without plaintext GVAS. Build and DLC metadata remain unknown."
    }
  ],
  "fields": [
    {
      "address": {
        "end": 433405,
        "kind": "absolute",
        "start": 433397
      },
      "approved_test_ids": [],
      "corpus_evidence": [],
      "experiment_ids": [],
      "format_profile": null,
      "id": "alignment.flags",
      "known_unknowns": [
        "Meanings lack controlled evidence"
      ],
      "last_review_date": "2026-08-15",
      "links_invariants": [],
      "observed_range": null,
      "platform_build_evidence": [],
      "primitive": "table-driven bits",
      "python_sources": [
        {
          "access": "read-write",
          "path": "src/kadishutu/core/game_save/alignment.py",
          "symbol": "AlignmentEditor"
        }
      ],
      "read_state": "candidate",
      "semantic_name": "Alignment flags",
      "sensitive": false,
      "write_state": "candidate"
    },
    {
      "address": {
        "base": 98930,
        "count": 256,
        "kind": "strided",
        "relative_end": 160,
        "relative_start": 88,
        "stride": 224
      },
      "approved_test_ids": [],
      "corpus_evidence": [],
      "experiment_ids": [],
      "format_profile": null,
      "id": "compendium.affinities",
      "known_unknowns": [
        "Count and complete boundaries are unknown; 256 is only the addressable u8 id space"
      ],
      "last_review_date": "2026-08-15",
      "links_invariants": [],
      "observed_range": null,
      "platform_build_evidence": [],
      "primitive": "sparse u16",
      "python_sources": [
        {
          "access": "read-write",
          "path": "src/kadishutu/core/game_save/compendium.py",
          "symbol": "RegisteredDemonEditor.affinities"
        }
      ],
      "read_state": "unknown",
      "semantic_name": "Compendium Affinities",
      "sensitive": false,
      "write_state": "unknown"
    },
    {
      "address": {
        "base": 98930,
        "count": 256,
        "kind": "strided",
        "relative_end": 196,
        "relative_start": 194,
        "stride": 224
      },
      "approved_test_ids": [],
      "corpus_evidence": [],
      "experiment_ids": [],
      "format_profile": null,
      "id": "compendium.innate_skill",
      "known_unknowns": [
        "Count and complete boundaries are unknown; 256 is only the addressable u8 id space"
      ],
      "last_review_date": "2026-08-15",
      "links_invariants": [],
      "observed_range": null,
      "platform_build_evidence": [],
      "primitive": "u16",
      "python_sources": [
        {